"paperName","researcher","journal","citations","year"
"Card surcharges and cash discounts: Simple economics and regulatory lessons","H Bourguignon, R Gomes, J Tirole","COMPETITION POL’Y INT’L 10, 12, 20, 2014","4","2014"
"Apprenticeships for employment","P Cahuc, M Ferracci, J Tirole, É Wasmer","Notes du conseil d’analyse économique, 1-12, 2014","4","2014"
"Bubbly liquidity","J Tirole, E Farhi","Review of Economic Studies 79 (2), 678-706, 2012","4","2012"
"Taxe carbone: de Charybde en Scylla?","C Gollier, J Tirole","IDÉES, 15, 2010","4","2010"
"A Primer on Payment Cards","JC Rochet, J Tirole","Report Prepared for the Portuguese Competition Authority, 2005","4","2005"
"Willpower and Personal Rules","J Tirole","Journal of Political Economy, 2004","4","2004"
"Concessions, concurrence et incitations","J Tirole","C. Henry, E. Quinet, Concurrence et service public, Paris, L’Harmattan, 75-94, 2003","4","2003"
"Contours of employment protection reform. english adaptation of a report written for the French Conseil d’Analyse Economique","O Blanchard, J Tirole","","4","2003"
"Le risque régulatoire","JJ Laffont, J Tirole","Risques-Les Cahiers de l'Assurance 46, 86-89, 2001","4","2001"
"<U+7535><U+4FE1><U+7ADE><U+4E89>","JJ Laffont, J Tirole","<U+4EBA><U+6C11><U+90AE><U+7535><U+51FA><U+7248><U+793E>, 2001","4","2001"
"Network competition: II. Price discrimination","P Rey, J Tirole","RAND Journal of Economics 29, 38-56, 1998","4","1998"
"Trade-ins, upgrades, and buy-backs","D Fudenberg, J Tirole","Rand Journal of Economics 29, 1998","4","1998"
"The Theory OF Industrial Organization 324","J Tirole","MIT Press, 1993","4","1993"
"A Theory of Dynamic Oligopoly: Parts I-III","E Maskin, J Tirole","Harvard Institute of Economic Research, 1986","4","1986"
"Introduction à certains travaux théoriques sur la Recherche-Développement","R Guesnerie, J Tirole","Ecole des hautes études en sciences sociales, 1985","4","1985"
"Sequential bargaining with many buyers","D Fudenberg, DK Levine, J Tirole","Cambridge, Mass.: Dept. of Economics, Massachusetts Institute of Technology, 1985","4","1985"
"Liquidity regulation, bail-ins and bailouts","M Dewatripont, J Tirole","Working paper, IDEI, 2018","3","2018"
"Economics for the Common Good","J Tirole","PANOECONOMICUS 65 (2), 255-266, 2018","3","2018"
"Eliciting Moral Preferences","R Bénabou, A Falk, J Tirole","Mimeo, 2018","3","2018"
"Rebuilding the health insurance system","B Dormont, PY Geoffard, J Tirole","Notes du conseil d’analyse économique, 1-12, 2014","3","2014"
"La théorie économique de la régulation des licenciements","J Tirole","Commentaire, 65-72, 2014","3","2014"
"Reforming French Bankruptcy Law","G Plantin, D Thesmar, J Tirole","Notes du conseil d’analyse économique, 1-12, 2013","3","2013"
"La crise de l’euro: quelques éléments de réflexion sur la réforme institutionnelle","J TIROLE","Revue de la Stabilité Financière 16, 253-272, 2012","3","2012"
"Materialistic Genius and Market Power: Uncovering the Best Innovations","J Tirole, G Weyl","IDEI Working Papers, 2010","3","2010"
"Monitoring the indebtedness of banks and countries: reflexions on regulatory reforms and international institutions","J Tirole","","3","2010"
"Balancing the Banks","JC Rochet, J Tirole","Princeton University Press, 2010","3","2010"
"Speculative Attacks and Risk Management","PA Pathak, J Tirole","American Economic Review, 2006","3","2006"
"Normes et Propriété Intellectuelle: la vue d'un économiste","J Tirole","Lettre de l'Autorité de Régulation des Communications Electroniques et des …, 2006","3","2006"
"Lobbying games","AP Semenov","Dissertation, University of Toulouse, 2005","3","2005"
"Retail electricity consumption","P Joskow, J Tirole","University of Cambridge Department of Applied Economics, 2004","3","2004"
"Cooperative market agreements between competitors: evidence from patent pools","J Lerner, J Tirole, M Strojwas","National Bureau of Economic Research, 2003","3","2003"
"Liquidity, Asset Pricing and Public Policy","J Tirole","Annual Meeting Plenary, 2003","3","2003"
"Competition in telecommunications","D Mandy","Southern Economic Journal 68 (1), 190-199, 2001","3","2001"
"Les idées nouvelles sur lintégration verticale: un guide informel de lutilisateur","J Tirole","Annales des télécommunications 50 (2), 256-264, 1995","3","1995"
"Game Theory (Massachusetts Institute of Technology)","D Fudenberg, J Tirole","","3","1993"
"De la désétatisation en Europe de l'Est","P Aghion, I Grosfeld, P Bolton, J Tirole","Revue de l'OFCE 34 (1), 195-213, 1990","3","1990"
"Your use of the JSTOR archive indicates your acceptance of the Terms & Conditions of Use, available at.","CL Arnold, WF Libby","Taxon 36 (2), 427-428, 1987","3","1987"
"Procurement, Cost Overruns and Severance. A Study in Commitment and Renegotiation","J Tirole","STANFORD UNIV CA INST FOR MATHEMATICAL STUDIES IN THE SOCIAL SCIENCES, 1984","3","1984"
"Differential thermal analysis of wavellite","FN Blanchard","Quarterly Journal of the Florida Academy of Sciences 30 (3), 161-167, 1967","3","1967"
"Competition in Telecommunications, 2000","JJ Laffont, J Tirole","London: MIT Press, 0","3",""
"Imperfect Markets and Imperfect Regulation: An Introduction to the Microeconomics and Political Economy of Power Markets","TO Léautier","MIT Press, 2019","2","2019"
"Taxing Unwanted Populations: Fiscal Policy and Conversions in Early Islam","M Saleh, J Tirole","Working Paper. Toulouse School of Economics, 2018","2","2018"
"Strengthening French venture capital","M Ekeland, A Landier, J Tirole","Notes du conseil d’analyse économique, 1-12, 2016","2","2016"
"<U+516C><U+53F8><U+91D1><U+878D><U+7406><U+8BBA>","J Tirole","Zhongguo ren min da xue chu ban she, 2015","2","2015"
"The Contours of Banking and the Future of Its Regulation","J Tirole","Olivier Blanchard et al., What Have We Learned, 143-154, 2014","2","2014"
"Défaillances de marché et politiques publiques","J Tirole","Traduction de la Nobel lecture de l’auteur, présentée à´ Stockholm le 8 …, 2014","2","2014"
"protection. A","O Blanchard, J Tirole","","2","2006"
"Incentives and prosocial behavior","J Tirole, R Bénabou","National Bureau of Economic Research, 2005","2","2005"
"The Economics of Technology Sharing: Open Source and Beyond","J Tirole, J Lerner","NBER Working Paper, 2004","2","2004"
"Macroeconomic theory and economic policy: essays in honour of Jean-Paul Fitoussi","KV Velupillai","Routledge, 2004","2","2004"
"Cooperative Marketing Agreements between Competitors: Evidence from Patent Pools","M Strojwas, J Tirole, J Lerner","Harvard NOM Working Paper, 2003","2","2003"
"Self knowledge and self regulation: an economic approach","J Tirole, R Zeckhauser","Psychology of Economic Decisions. Vol. 1: Rationality and Well-being, 2003","2","2003"
"<U+30C6><U+30EC><U+30B3><U+30E0><U+7523><U+696D><U+306B><U+304A><U+3051><U+308B><U+7AF6><U+4E89>","JJ Laffont, J Tirole","<U+30A8><U+30B3><U+30CE><U+30DF><U+30B9><U+30C8><U+793E>, 2003","2","2003"
"Transparency and tacit collusion in a differentiated market","C Schultz","CESifo Working Paper Series, 2002","2","2002"
"Auctioning Incentive Contracts'","L Jean-Jacques, J Tirole","INTERNATIONAL LIBRARY OF CRITICAL WRITINGS IN ECONOMICS 113, 290-306, 2000","2","2000"
"A liquidity based asset pricing model","B Holmstrm, J Tirole","Cambridge, Mass.: Massachusetts Institute of Technology, 1998","2","1998"
"Some Implications of Growth for Ownership Structure and Organisational Forms","P Aghion, J Tirole","European Economic Review, 1995","2","1995"
"A Theory of Debt and Equity: Diversity of Securities and Manager3Share3holder Congruence","M Dewatripont, J Tirole","Quarterly Journal of Economics 109, 102731054, 1994","2","1994"
"A Theory of Incentives in Procurement and Regulation","KM Schmidt","Journal of Institutional and Theoretical Economics (JITE)/Zeitschrift für …, 1994","2","1994"
"Game Theory Cambridge","D Fundenberg, J Tirole","Massachusetts: The MIT J, 1992","2","1992"
"VThe Theory of Industrial OrganisationV Cambridge: MA","J Tirole","USA The MIT Press, 1988","2","1988"
"Procurement, Cost Overruns and Severance","Stanford University. Institute for Mathematical Studies in the Social Sciences","","2","1984"
"Global Carbon Pricing: The Path to Climate Cooperation","RN Cooper, C Gollier, WD Nordhaus, I Parry, JE Stiglitz, J Tirole, ...","MIT Press, 2017","1","2017"
"Algorithmic Trading and Mutual Fund Performance","KYL Fong, JT Parwada, JW Yang","Available at SSRN 2980774, 2017","1","2017"
"Bonus culture: Competitive pay, screening, and multitasking","J Tirole","Journal of Political Economy 124 (2), 2016","1","2016"
"CONFERENCIA DEL PREMIO NOBEL, 8 DE DICIEMBRE DE 2014 (*)(**): FALLOS DE MERCADO Y POLÍTICAS PÚBLICAS","J Tirole","Papeles de Economía Española, 2, 2015","1","2015"
"Financial regulation","J Tirole","Rethinking Macro Policy II: First Steps and Early Lessons, 2013","1","2013"
"Laffont, Jean-Jacques (1947–2004)","J Tirole","The New Palgrave Dictionary of Economics: Volume 1–8, 3559-3562, 2008","1","2008"
"Preemption and the Efficiency of Entry","R Argenziano, P Schmidt-Dengler","University of Essex mimeo, 2008","1","2008"
"Addendum to ‘Speculative Attacks and Risk Management’","P Pathak, J Tirole","","1","2006"
"Quel rôle pour le FMI?","J Tirole, F Zumer","Commentaire, 927-936, 2004","1","2004"
"Inefficient Foreign Borrowing: A Dual0and Common0Agency Perspective","J Tirole","","1","2002"
"Competition in Telecommunications","G Knieps","Journal of Institutional and Theoretical Economics (JITE)/Zeitschrift für …, 2001","1","2001"
"Preemption and Rent Equalization in the Adoption of New Technology","D FUDENBERG, J TlROLE","Readings in industrial organization 52, 350, 2000","1","2000"
"Psychology and economics: self-confidence and social interactions","J Tirole","","1","2000"
"LAPM","B Holmstro¨m, J Tirole","National Bureau of Economic Research, 1998","1","1998"
"Liberalization and Interconnection Charges","JJ LAFFONT, J TIROLE","ANNALES DES TELECOMMUNICATIONS-ANNALS OF TELECOMMUNICATIONS 50 (2), 306-314, 1995","1","1995"
"The Folk Theorem with Imperfect Public Information","E Maskin, D Fudenberg, D Levine","Econometrica 62 (5), 1994","1","1994"
"Bengt Holmstrom","J Tirole","The Journal of Political Economy 101 (4), 678-709, 1993","1","1993"
"The Provision of Quality in Procurement","JJ Laffont, J Tirole","Incentives in procurement contracting. Pew Studies in Economics and Security …, 1993","1","1993"
"Corrigendum to'A Theory of Dynamic Oligopoly, III, Cournot Competition'(vol. 31, no. 4)","E Maskin, J Tirole","European Economic Review 32 (7), 1567-1568, 1988","1","1988"
"The theory of the firm","B Holmstrm, J Tirole","Cambridge, Mass: Dept. of Economics, Massachusetts Institute of Technology, 1987","1","1987"
"Using Cost Observation to Regulate Firms","J Tirole, JJ Laffont","Massachusetts Institute of Technology (MIT), Department of Economics, 1985","1","1985"
"Correlated equilibria and sunspots: a note","E Maskin, J Tirole","Cambridge, Mass.: Massachusetts Institute of Technology, Dept. of Economics, 1985","1","1985"
"On the efficiency of Keynesian equilibrium","E Maskin, J Tirole","Cambridge, Mass.: Dept. of Economics, Massachusetts Institute of Technology, 1980","1","1980"
"An Inquiry into the Nature and Causes of the Wealth of Nations.","Y Xiani, DA Baker, LH Guo, DH Jin, B Holmstrom, J Tirole, RJ Liu, ...","Journal of Applied Sciences 13 (16), 13-18, 1979","1","1979"
"The Mission","HE Bolton, J TIROLE","New Spain’s Far Northern Frontier Essays on Spain in the American West, 1540 …, 1979","1","1979"
"Essais sur le calcul économique public et sur le taux d'actualisation","J Tirole","","1","1978"
"Price Caps as Welfare-Enhancing Coopetition","P Rey, J Tirole","Journal of Political Economy 127 (6), 000-000, 2019","","2019"
"Taxing Identity: Theory and Evidence from Early Islam","M Saleh, J Tirole","CEPR Discussion Paper No. DP13705, 2019","","2019"
"Narratives, Imperatives, and Moral Reasoning","BÃ Roland, A Falk, J Tirole","CRC TR 224 Discussion Paper Series, 2019","","2019"
"Leave Room for Growth","E Macchiavello, V Acharya, I Hasan, A Saunders, R Adams, H Mehran, ...","Microfinance and Financial Inclusion: The Challenge of Regulating …, 2018","","2018"
"Taxing Identity: Fiscal Policy and Conversions in Early Islam","M Saleh, J Tirole","Mimeo, Toulouse School of Economics, 2018","","2018"
"DP13056 Narratives, Imperatives, and Moral Reasoning","R Bénabou, A Falk, J Tirole","","","2018"
"Craft Control and the Division of Labour: Engineers and Compositors in Britain 1890–1930","A Kalhan, A Kalhan, A Kalhan, KS Abraham, D Acemogul, S Ackroyd, ...","Work in a Metro: Intense, Flexible, Insecure 19 (3), 17-65, 2018","","2018"
"DP12832 Missed Sales and the Pricing of Ancillary Goods","R Gomes, J Tirole","","","2018"
"SHADOW BANKING AND THE FOUR PILLARS OF TRADITIONAL FINANCIAL INTERMEDIATION 1","J Tirole","Revista de Economía 24 (2), 7-30, 2017","","2017"
"DP12373 Shadow Banking and the Four Pillars of Traditional Financial Intermediation","E Farhi, J Tirole","","","2017"
"On everyday academic research","J Tirole","VOPROSY ECONOMIKI 9, 2017","","2017"
"An economist in the public space","J Tirole","VOPROSY ECONOMIKI 8, 2017","","2017"
"Corporate finance and corporate governance","AK Agrawal, C Catalini, A Goldfarb, G Akerlof, R Shiller, AA Alchian, ...","Behavioural Approaches to Corporate Governance 62 (December), 1-3, 2016","","2016"
"DP11024 Deadly Embrace: Sovereign and Financial Balance Sheets Doom Loops","E Farhi, J Tirole","","","2015"
"From Bottom of the Barrel to Cream of the Crop: Sequential Screening with Positive Selection. Online Appendix: Partnerships","J Tirole","","","2015"
"À lire","P Betbèze, A Brender, JM Charpin, JM Chevalier, R Contamin, B Fulda, ...","Vecteur Environnement, 2015","","2015"
"Time discounting and discounting time","JS Abramowitz, R Adolphs, A Agassi, G Ainslie, MDS Ainsworth, ...","Addiction: A Behavioral Economic Perspective 51 (1), vii-vii, 2015","","2015"
"Economics 712: Topics in Game Theory","D Fudenberg, J Tirole, G Mailath, L Samuelson","","","2015"
"Will climate change capitalism? The major change of the X XI century","J Mistral, J Tirole, M Rocard, P Artus, F Benhamou, JP Betbeze, A Brender, ...","","","2015"
"DP10188 The Elephant in the Ground: Managing Oil and Sovereign Wealth","T Van Den Bremer, F van der Ploeg, S Wills","","","2014"
"DP10171 Shrouded Transaction Costs","H Bourguignon, R Gomes, J Tirole","","","2014"
"What Have We Learned?: Macroeconomic Policy after the Crisis","G Dell'Ariccia, P Mauro, J Yellen, LB Smaghi, M King, M Woodford, ...","MIT Press, 2014","","2014"
"Rationalité, psychologie et économie","J Tirole","Problèmes économiques: Selection d'articles français et étrangers, 46-48, 2014","","2014"
"Les contours de l'activité bancaire et l'avenir de sa régulation","J Tirole","Revue française d'économie 29 (3), 93-109, 2014","","2014"
"Comment on"" Pledgability and Liquidity: A New Monetarist Model of Financial and Macroeconomic Activity""","J Tirole","NBER Macroeconomics Annual 2013, Volume 28, 279-286, 2013","","2013"
"Les enjeux économiques du droit des faillites: Note du Conseil d'Analyse Économique n° 7","G Plantin, D Thesmar, J Tirole","Sciences Po publications, 2013","","2013"
"DP9419 Bonus Culture: Competitive Pay, Screening, and Multitasking","R Bénabou, J Tirole","","","2013"
"Bonus Culture","R Bénabou, J Tirole","","","2012"
"Information, Tranching and Liquidity","J Tirole, E Farhi","","","2012"
"Front matter and Introduction to"" Innovation Policy and the Economy, Volume 13""","J Lerner, S Stern","Innovation Policy and the Economy, Volume 13, 0-0, 2012","","2012"
"Preventing and Resolving Banking and Sovereign Crises: Toward a New Institutional Framework","J Tirole","Rivista di Politica Economica, 143-153, 2012","","2012"
"Balancing the Banks: Global Lessons from the Financial Crisis","M Richardson","Journal of Economic Literature 49 (4), 1273-1278, 2011","","2011"
"DP8663 Laws and Norms","R Bénabou, J Tirole","","","2011"
"Online Appendix to Market Power Screens Willingness-to-Pay","EG Weyl, J Tirole","","","2011"
"Bureaucracy and Freedom: NM Korkunov’s Theory of the State","A Oleinik, A Oleinik, M Afanasiev, G Ailon, A Akhiezer, V Aksenov, ...","Market as a Weapon: The Socio-Economic Machinery of Dominance in Russia 16 …, 2011","","2011"
"VEILLE STRATÉGIQUE-Réglementation des cartes de paiement-Une application de l'analyse économique à la politique de la concurrence","J Tirole","Banque Strategie, 41, 2011","","2011"
"Réglementation et sécurité-RÉGLEMENTATION DES PAIEMENTS PAR CARTES-Une application de l'analyse économique à la politique de concurrence","J Tirole","Revue Banque, 28, 2011","","2011"
"Online Appendix to Materialistic Genius and Market Power","EG Weyl, J Tirole","","","2010"
"Regional Initiatives and the Cost of Delaying Binding Climate Change Agreements","J Tirole","","","2010"
"La responsabilità sociale: l'individuo e l'impresa","R Bénabou, J Tirole","Equilibri 14 (2), 255-280, 2010","","2010"
"Diversification Entry: Internal Development versus Acquisition","ZJ Acs, DB Audretsch, R Agarwal, DB Audretsch, P Aghion, P Bolton, ...","Barriers to Competition: The Evolution of the Debate 69 (4), 1-16, 2010","","2010"
"Comment contrôler les déficits budgétaires","J Tirole","Commentaire, 804-805, 2010","","2010"
"Lessons from the Crisis","M Dewatripont, JC Rochet, J Tirole","Introductory Chapters, 2010","","2010"
"Prerequisites","D Fudenberg, J Tirole, D Levine, V Krishna, G Mailath, L Samuelson, ...","","","2010"
"Intrinsic Motivation, Incentives, and Social Norms","J Tirole","Revue économique 60 (3), 577-589, 2009","","2009"
"Les tabous, nouvelles frontières de l'économie","J Tirole","Sciences humaines, 15-15, 2009","","2009"
"Et si Copenhague échouait? Rapport du Conseil d'analyse économique","J Tirole","Problemes Economiques, 20, 2009","","2009"
"The economics of global warming","J Tirole","'Angelo Costa'Lectures Serie, 2009","","2009"
"Economia politica del riscaldamento globale","J Tirole","RIVISTA DI POLITICA ECONOMICA, 2008","","2008"
"On Networks and Markets by Rauch and Casella, eds","P Abell, P Aggarwal, S Law, JC Agnew, S Strasser, JC Agnew, GA Akerlof, ...","Moral Markets: How Knowledge and Affluence Change Consumers and Products 1 …, 2008","","2008"
"THE CARLO ALBERTO NOTEBOOKS","MC Chiuri, D Del Boca","","","2008"
"A fine balance","J Tirole","Business Strategy Review 19 (1), 94-95, 2008","","2008"
"Phanish Puranam on flatness; and Jean Tirole on multi-sided markets","J Tirole","Business Strategy Review 19 (1), 90-95, 2008","","2008"
"La concurrence ne doit pas être une religion","J TIROLE, X DE LA VEGA","Sciences humaines, 24-27, 2008","","2008"
"The Rules of Standard Setting Organizations: An Empirical Analysis","J Lerner, B Chiao, J Tirole","","","2007"
"DP6123 Identity, Dignity and Taboos: Beliefs as Assets","R Bénabou, J Tirole","","","2007"
"DP6127 The Joint Design of Unemployment Insurance and Employment Protection. A First Pass","OJ Blanchard, J Tirole","","","2007"
"DP6121 Reliability and Competitive Electricity Markets","PL Joskow, J Tirole","","","2007"
"DP6132 Tying-in Two-Sided Markets and the Honour All Cards Rule","JC Rochet, J Tirole","","","2007"
"DP6141 The Rules of Standard Setting Organizations: An Empirical Analysis","B Chiao, J Lerner, J Tirole","","","2007"
"IDENTITY, DIGNITY AND TABOOS","J Tirole","","","2007"
"La théorie des jeux et de l'information","J TIROLE, JJ LAFFONT","PCM le pont 105 (7-8), 6-9, 2007","","2007"
"RAND Journal of Economics: Introduction","JC Rochet, J Tirole","RAND Journal of Economics 37 (3), 643-644, 2006","","2006"
"Symposium on two-sided markets-Introduction","JC Rochet, J Tirole","RAND JOURNAL OF ECONOMICS 37 (3), 643-644, 2006","","2006"
"The Mario Einaudi Center for International Studies","R Bénabou, J Tirole","","","2006"
"Lectures on Political and Economic Anthropology","A Macfarlane","","","2006"
"Retail Electricity Competition","J Tirole, P Joskow","HAL Post-Print, 2006","","2006"
"A Theory of Forum Shopping","J Tirole","HAL Post-Print, 2006","","2006"
"Responsabiliser les entreprises en taxant les licenciements","O Blanchard, J Tirole","PROBLEMES POLITIQUES ET SOCIAUX 931, 40, 2006","","2006"
"Certifying New Technologies","J Lerner, J Tirole, E Farhi","","","2005"
"DP4952 Belief in a Just World and Redistributive Politics","R Bénabou, J Tirole","","","2005"
"Quel role pour le FMI?","J Tirole","PROBLEMES ECONOMIQUES 2882, 30, 2005","","2005"
"DP4633 Incentives and Prosocial Behaviour","R Bénabou, J Tirole","","","2004"
"Woodrow Wilson School of Public and International Affairs","R Bénabou, J Tirole","","","2004"
"A Model of Forum Shopping, with Special Reference to Standard Setting Organizations","J Tirole, J Lerner","NBER Working Paper, 2004","","2004"
"Addendum to “Pegs, Risk Management, and Financial Crises”","PA Pathak, J Tirole","","","2004"
"Contours of employment protection reform: Olivier Blanchard And Jean Tirole","O Blanchard, J Tirole","Macroeconomic Theory and Economic Policy, 61-100, 2004","","2004"
"Competitive Electricity Markets","P Joskow, J Tirole","Energy Policy Research Group, Cambridge Judge Business School, University of …, 2004","","2004"
"March 15, 2004","P Joskow, J Tirole","","","2004"
"January 12, 2004","P Joskow, J Tirole","","","2004"
"Timothy J. Kehoe University of Minnesota and Federal Reserve Bank of Minneapolis October 2003 Jean Tirole is a distinguished economist, well known for his contributions to game …","J Tirole","","","2003"
"The Theory of Corporate Finance.","G Qiuping, T Cunzhi, L Jiangqi, AL Eisfeldt, AA Rampini, AL Eisfeldt, ...","Journal of Applied Sciences 13 (13), 177-199, 2003","","2003"
"Jerry A. Hausman Gregory K. Leonard and","J Tirole","RAND Journal of Economics 34 (1), 1-000, 2003","","2003"
"Symposium on evaluating economics research in Europe","JP Neary, JA Mirrlees, J Tirole","Journal of the European Economic Association 1 (6), 1240-1401, 2003","","2003"
"INTERNET INTERCONNECTION AND THE OFF-NET-COST PRICING PRINCIPLE 2002","JJ Laffont, S Marcus, P Rey, J Tirole","Hanken School of Economics, 2002","","2002"
"TRANSPARENCY AND TACIT COLLUSION IN A DIFFERENTIATED MARKET Christian Schultz* CESifo Working Paper No. 730 (9)","LL Harrington, P Møllgaard, J Tirole","","","2002"
"Reaching Higer Productivity Growth in France and Germany","H Gersbach, O Blanchard, MN Baily, J Tirole, M Schnitzer","ETH Zurich, 2002","","2002"
"DP3143 Willpower and Personal Rules","R Bénabou, J Tirole","","","2002"
"Annual Report on the Association's Activities in 2001","J TIROLE","European Economic Review 46 (958), 960, 2002","","2002"
"DP3149 Self Control in Peer Groups","M Battaglini, R Bénabou, J Tirole","","","2002"
"Competition in Telecommunications","SP King","Economic Record 77 (238), 316, 2001","","2001"
"DP2802 Essential Facility Financing and Market Structure","B Caillaud, J Tirole","","","2001"
"The Regulation of Multiproduct Firm: Part I: Theory","JJ Laffont, J Tirole","Welfare Economics 3, 521-556, 2001","","2001"
"Creating Competition through Interconnection: Theory and Practice","JJ Laffont, J Tirole","Welfare Economics 1, 531-560, 2001","","2001"
"The Regulation of Multiproduct Firm: Part II: Applications to Competitive Environments and Policy Analysis","JJ Laffont, J Tirole","Welfare Economics 3, 557-586, 2001","","2001"
"doi: 10.1006 Âjeth. 2001.2884, available online at http: ÂÂwww. idealibrary. com on","CD Aliprantis, A Bogomolnaia, J Davila, B Eckwert, LG Epstein, ...","Journal of Economic Theory 100, 389, 2001","","2001"
"The Regulation of Multiproduct Firms-Part I: Theory'andThe Regulation of Multiproduct Firms-Part II: Applications to Competitive Environments and Policy Analysis'","JJ Laffont, J Tirole","INTERNATIONAL LIBRARY OF CRITICAL WRITINGS IN ECONOMICS 126, 521-588, 2001","","2001"
"DP2579 Self-Confidence & Social Interactions","R Bénabou, J Tirole","","","2000"
"DP2580 Self-Confidence: Intrapersonal Strategies","R Bénabou, J Tirole","","","2000"
"Loyalty and Investment in cooperatives|","P Reyi, J Tirole","","","2000"
"Market Power in Theory and Practice","P Joskow, J Tirole, TA Johnsen, SK Verma, C Wolfram","","","2000"
"Center for Economic Institutions","J Tirole","","","2000"
"L'infrastructure institutionnelle de la politique de concurrence","J Tirole","Revue d'économie du développement 8 (1), 123-132, 2000","","2000"
"Privatization and Incentives', Journal of Law, Economics and Organization, 7, 84-105","JJ Laffont, J Tirole","INTERNATIONAL LIBRARY OF CRITICAL WRITINGS IN ECONOMICS 123, 94-115, 2000","","2000"
"Vol. 67-Fall 2000","JJ Laffont, J Tirole, D Shaviro","The University of Chicago Law Review 67, 2000","","2000"
"Psychology and Economics","J Tirole","","","2000"
"CENTER FOR LAW, ECONOMICS AND ORGANIZATION RESEARCH PAPER SERIES","JJ Laffont, T N’Guessan","","","1999"
"DP2101 Cooperation Among Competitors: The Economics of Credit Card Associations","JC Rochet, J Tirole","","","1999"
"DP2093 Transmission Rights and Market Power on Electric Power Networks I: Financial Rights","PL Joskow, J Tirole","","","1999"
"<U+8B1B><U+8AAD>·<U+7523><U+696D><U+7D44><U+7E54><U+8AD6>--<U+7523><U+696D><U+7D44><U+7E54><U+8AD6><U+30CF><U+30F3><U+30C9><U+30D6><U+30C3><U+30AF> <U+7B2C> 2 <U+7AE0> <U+300C><U+4F01><U+696D><U+306E><U+7406><U+8AD6><U+300D>(1)","<U+6E05><U+6C34><U+65B9><U+5B50>","<U+90F5><U+653F><U+7814><U+7A76><U+6240><U+6708><U+5831> 12 (3), 101-122, 1999","","1999"
"DP2086 Corporate Governance","J Tirole","","","1999"
