"paperName","researcher","journal","citations","year"
"Mathias Devvatripont","J Tirole","The Journal of Political Economy 107 (1), 1-39, 1999","","1999"
"DP2087 Transmission Rights and Market Power on Electric Power Networks. II: Physical Rights","PL Joskow, J Tirole","","","1999"
"to the persistence of corruption and to firm quality","J TIROLE","The Economics of Corruption and Illegal Markets 1, 208, 1999","","1999"
"'The Fat-Cat Effect, The Puppy-Dog Ploy, and the Lean and Hungry Look', American Economic Review Papers and Proceedings, 74 (2), May, 361-6","D Fudenberg, J Tirole","INTERNATIONAL LIBRARY OF CRITICAL WRITINGS IN ECONOMICS 102, 327-332, 1998","","1998"
"'A Theory of Dynamic Oligopoly, II: Price Competition, Kinked Demand Curves, and Edgeworth Cycles', Econometrica, 56 (3), May, 571-99","E Maskin, J Tirole","INTERNATIONAL LIBRARY OF CRITICAL WRITINGS IN ECONOMICS 102, 76-104, 1998","","1998"
"Vol. CXII August 1997 Issue 3","F INTERMEDIATION, B HOLMSTROM, J TIROLE","The Quarterly Journal of Economics 112 (3), 663-691, 1997","","1997"
"Network competition: part I and","JJ Laffont, P Rey, J Tirole","Institut d'economie industrielle, Université des Sciences sociales de Toulouse, 1997","","1997"
"to the persistence of corruption and to <U+FB01>rm quality","J TIROLE","","","1996"
"Using Cost Observation to Regulate Firms","JJ Laffont, J Tirole","Economics of Defense 2, 239-266, 1995","","1995"
"Changing views of the corporate income tax.","Y Wu, C Tian, J Arlen, DM Weiss, R Chetty, E Saez, D Hackbarth, ...","Information Technology Journal 12 (14), 325-391, 1995","","1995"
"Inside and Outside Liquidity.","Y Xiani, T Cunzhi, J Arlen, DM Weiss, J Arlen, WB MacLeod, J McLure, ...","Information Technology Journal 12 (14), 325-391, 1995","","1995"
"A theory of income and","D Fudenberg, J Tirole","Version http://dx. doi. org/10.1086/261976, 1995","","1995"
"CORPORATE STRUCTURE, R-AND-D AND INCENTIVES","J Tirole, E Turpin","ANNALES DES TELECOMMUNICATIONS-ANNALS OF TELECOMMUNICATIONS 50 (1), 165-184, 1995","","1995"
"Structures dentreprise, R&D et incitationsCorporate structure, R&D and incentives","J Tirole, E Turpin","Annales des télécommunications 50 (1), 165-184, 1995","","1995"
"A Theory of Incentives in Procurement and Regulation","I Vogelsang","Journal of Economics 59 (3), 335-339, 1994","","1994"
"Financial support from the NSF is gratefully acknowledged. All errors are my own. This paper is part of NBER's research program in Growth. Any opinions expressed are those of …","J Heaton, J Tirole, Y Weiss","","","1993"
"PeTlistence of Corruption","J Tirole","","","1992"
"GAME-THEORY AND ECONOMIC MODELING-KREPS, DM","J Tirole","Journal of economic literature 30 (2), 895-896, 1992","","1992"
"IN HONOR OF KREPS, DAVID, WINNER OF THE CLARK, JOHN, BATES MEDAL","J TIROLE","JOURNAL OF ECONOMIC PERSPECTIVES 4 (3), 149-170, 1990","","1990"
"Business cycle fluctuations in US macroeconomic time series.","M Kaplan, R Barro, A Bhide, M Binswanger, M Binswanger, F Canova, ...","Journal of Applied Sciences 8 (2), 115-131, 1990","","1990"
"[BOOK REVIEW] The theory of industrial organization","J Tirole","Journal of Political Economy 98, 668-671, 1990","","1990"
"A Theory of Dynamic Oligopoly, II","E Maskin, J Tirole","Econometrica: Journal of the Econometric Society, 1501-1501, 1989","","1989"
"Erratum: Preemption and Rent Equalization in the Adoption of New Technology","D Fudenberg, J Tirole","The Review of Economic Studies 55 (3), 507-507, 1988","","1988"
"£ cole des Hautes Etudes en Sciences Sociales","F Bourguignon, H Boussouf-Idrissi, A Bozio, C Chamley, D Cogneau, ...","Modelling the accumulation and distribution of wealth, 257, 1988","","1988"
"Repeated Auctions of Incentive Contracts, Investment and Bidding Parity With an Application to Takeovers","J Tirole, JJ Laffont","Massachusetts Institute of Technology (MIT), Department of Economics Working …, 1987","","1987"
"Une théorie normative des contrats Etats-Entreprises in Numéro spécial sur l'économie industrielle","JJ LAFFONT, J TIROLE","Annales d'Economie et de Statistique, 107-132, 1986","","1986"
"The MIT Press","B Holmstrom, JRI Costa","","","1986"
"ECONOMICS, & ORGANIZATION","J Tirole, V Vanberg, JM Buchanan, A Schwartz, LA Bebchuk, R Craswell, ...","ORGANIZATION 2 (2), 1986","","1986"
"THE ECONOMICS OF RD INTRODUCTION TO THE PURE THEORY","J TIROLE","REVUE ECONOMIQUE 36 (5), 843-871, 1985","","1985"
"ACKNOWLEDGMENT 403 Michael JP Magi11 Andreu Mas-Cole11 Richard McLean Andrew McLennan","D Nachman, D Newbery, W Novshek, Y Nyarko, ES Phelps, R Porter, ...","Journal of Economic Theory 35, 402403, 1985","","1985"
"Essays in economic theory","J Tirole","Massachusetts Institute of Technology, 1981","","1981"
"Gradient projection algorithms for problems in public finance: a note","J Tirole, R Guesnerie","Cepremap, 1979","","1979"
"DILEMMAS OF DOLLAR-ECONOMICS AND POLITICS OF UNITED-STATES INTERNATIONAL MONETARY-POLICY-BERGSTEN, CF","S WEINTRAUB","JOURNAL OF ECONOMIC LITERATURE 15 (1), 134-135, 1977","","1977"
"Narratives, Imperatives, and Moral Persuasion","R Bénabou, A Falk, J Tirole","","",""
"A Theory of Income and Dividend Smoothing Based on Incumbency Rents","J Tirole, D Fudenberg","University of Chicago Press, 0","",""
"Incomplete Information Bargaining with Outside Opportunities","J Tirole, D Levine, D Fudenberg","MIT Press, 0","",""
"GLOBAL LESSONS FROM THE FiNANCiAL CRiSiS","M DEWATRIPONT, JC ROCHET, J TIROLE","","",""
"Jean Tiróle Econometrica; Jan 2001; 69, 1; ABI/INFORM Global Pg-!","J Tiróle","","",""
"The Economics of Career Concerns, Part II: Application to Missions","M DEWATRIPONT, IAN JEWITT, J TIROLE, G IDEI, MIT CERAS","","",""
"Forthcoming Handbook of Industrial Organization","J Tirole","","",""
"Note de lecture comparée","P Cahuc, A Zylberberg, J Tirole","","",""
"Frank Knight Preemptively Settles the Horse Race","J Watson, D Levine, E Fehr, K Schmidt, G Bolton, A Ockenfels, M Rabin, ...","","",""
"Public Sector Economics 2/2018","K OTT, D MIHALJEK, B ÉGERT, E KOCENDA, M KOLLATZ-AHNEN, ...","","",""
"The Suntory and Toyota International Centres for Economics and Related Disciplines","R BÉNABOU, J TIROLE","","",""
"in Bargaining. Psych. Rev. 86 (1979), pp. 574–94. Rubinstein, A.: Perfect Equilibrium in a Bargaining Model. Econometrica 50","D Levine, J Tirole","","",""
"The World Financial Crisis: What Have We Learned?","M Dewatripont, JC Rochet, J Tirole, J Taylor, K French","","",""
"THE VIEWS EXPRESSED HEREIN ARE THE AUTHOR'S RESPONSIBILITY AND DO NOT NECESSARILY REFLECT THOSE OF THE MLT ENERGY LABORATORY OR THE MASSACHUSETTS INSTITUTE OF TECHNOLOGY.","JJ Laffont, J Tirole","","",""
"Topics and Readings","D Fudenberg, J Tirole, D Levine, V Krishna, G Mailath, L Samuelson","Econometrica 50 (5), 1089-1122, 0","",""
"Technical Appendix for “Willpower and Personal Rules”","R Bénabou, J Tirole","","",""
"Browse Articles","S Sales, M Evans","","",""
"Scale Returns in Communication and Elite 1 Control of Organizations Kenneth J. Arrow Constructed Organization: First Principles 7","JS Coleman, J Design, B Holmstrom, P Milgrom, PL Joskow, JJ Laffont, ...","","",""
"Paul Joskow","PL JOSKOW","","",""
"l’approche principal—agent","P REY, J TIROLE","","",""
"État-entreprises","JJ LAFFONT, J TIROLE","","",""
"We Will If You Will","DJC MacKay, R Cooper, J Stiglitz, W Nordhaus, ML Weitzman, ...","","",""
"From The New Palgrave Dictionary of Economics, 2008 Edited by Steven N. Durlauf and Lawrence E. Blume","J Tirole","","",""
"Department of Economics Research and Teaching Output of the MIT Community","HL Rosenthal, KF Feldstein, AW Bartik, PD Hull","","",""
"rules of the game. If, say, oligopolists obtain low pro<U+FB01>ts by playing some market game, they","J TIROLE","","",""
"<U+FB01>PlQlfh< E","O Hart, J Tirole","","",""
"Textos Principales","P Bolton, JJ Laffont, J Tirole, I Macho-Stadler, D Pérez-Castrillo, ...","","",""
"Economics-Ph. D./Sc. D. Research and Teaching Output of the MIT Community","KF Feldstein, AW Bartik, PD Hull","","",""
"922 INDEX TO VOLUME 70","F Lippi, NAW Setters, D Martimort, D Mookherjee, WK Newey, ...","","",""
"Theses-Dept. of Economics Research and Teaching Output of the MIT Community","KKO Takala, PS Fanelli, SM Abraham, AD Zucker, E Tironi","","",""
"ASYMMETRIC EQÜILBRIUM IN THE WAR OF ATTRITION","B Nalebuff, J Rileyt, JS Mirrlees, J Tiróle","","",""
"l.-EL OBJETO DE ESTUDIO DE LA ECONOMÍA INDUSTRIAL.","J Tiróle, DM Kreps, HR Varian","","",""
"de Melo, Jaime Agency Theory Bom, Patricia Agent Diamond, Peter","M Fujita, P Krugman, P Martin, D Puga, A Demand, R Layard, ...","","",""
"THE DYNAMICS OF INCENTIVE CONTRACT SI","BYJJ Larrom, J TIROLE","","",""
"15 Competition Policy in Two-Sided Markets, with on Payment Cards","JC Rochet, J Tirole","","",""
"Incomplete Contracts: Where Do We Stand? ST 0..","J Tirole","","",""
"Some reflections on Open Source Software Eloic Peyrache MPSE, University of Toulouse 1 Jacques Crémer CNRS, GREMAQ and IDEI, University of Toulouse","J Tirole","","",""
"Nobel Symposium Foundations of Organization","S Athey, S Barley, N Biggart, N Brunsson, R Burt, S Clegg, B Czarniawska, ...","","",""
"Taylor, John (1975)."" Monetary Policy During a Transition to Rational Expecta-tions.''Journal of Political Economy S3. 5, 1009-1021. Taylor, John B.(1977)."" Conditions for …","J Tiróle, O Generations, R Townsend, M Anticipations, K West, ...","Journal of Economics 102, 553-580, 0","",""
"Varían, HR Intermediate Microeconomics.(WW Norton and Co., 1993) [ISBN 0-393-96320-9] Chapter 27. Tiróle, J. Tfie Theory of industrial Organization.(The MIT Press, 1990)[ISBN 0 …","J Tiróle","","",""
"BEHAVIORAL INCENTIVE THEORY","J TIROLE","","",""
"THE NEW ECONOMICS OF REGULATION TEN YEARS AFTER Bv JEAN-Jacoues LAFFONT1","J Tirole","","",""
"This version: May 20, 2010","J Tirole","","",""
"Volume CXII August 1997 Issue 3","B HOLMSTROM, J TIROLE, M BURKART, D GROMB, F PANUNZI, ...","","",""
"uro 6ono eview 22 (19. North-I Iajlland","D Fudenberg, R Gilbert, J Stiglitz, J Tirole, GC d’Aspremont, P Nansen, ...","","",""
"Benjamin Chiao","B Chiao, J Lerner, J Tirole","","",""
"implies that BP (@) Q= BP (Q)(Z11—<U+FB01>z)> E. However, a U1-D1","O Hart, J Tirole","","",""
"Information Structures","M DEWATRIPONT, IAN JEWITT, J TIROLE, G IDEI, MIT CERAS","","",""
"Reviewer: Franklin Allen, Finance Department, Wharton School, University of Pennsylvania, Philadelphia, PA 19104, USA","J Tirole","","",""
"72 Robert\V. Rosenthal Roth, A., and M. Malouf: Game-Theoretic Models and the Role of Information in Bargaining. Psych. Rev 86 (1979), pp. 574-94. Rubinstein, A.: Perfect …","D Fudenberg, D Levine, J Tiróle","","",""
