"paperName","researcher","journal","citations","year"
"Some simple economics of open source","J Tirole, J Lerner","Journal of Industrial Economics 50 (2), 197-234, 2002","55","2002"
"Provision of quality and power of incentive schemes in regulated industries","JJ Laffont, J Tirole","Equilibrium Theory and Applications: Proceeding of the Sixth International …, 1991","55","1991"
"Valuing adaptation under rapid change","RN Jones, C Young, J Handmer","National Climate Change Adaptation Research Facility, 2013","52","2013"
"Liquidity shortages: theoretical underpinnings","J Tirole","Banque de France Financial Stability Review: Special Issue on Liquidity 11 …, 2008","52","2008"
"Over my dead body: Bargaining and the price of dignity","R Bénabou, J Tirole","American Economic Review 99 (2), 459-65, 2009","51","2009"
"Redesigning the employment protection system","O Blanchard, J Tirole","De Economist 152 (1), 1-20, 2004","51","2004"
"The Theory of Industrial Organization, vol. 1 of MIT Press Books","J Tirole","The MIT Press, 1988","51","1988"
"The rules of standard setting organizations: an empirical analysis","B Chiao, J Lerner, J Tirole","National Bureau of Economic Research, 2005","50","2005"
"Economic perspectives on open source","J Lerner, J Tirole","Intellectual Property and Entrepreneurship, 33-69, 2004","49","2004"
"A theory of incentives in procurement and regulation","J Tirole, JJ Laffont","MIT Press, 1993","49","1993"
"The new Palgrave dictionary of economics","RJ Shiller, J Tirole, O Williamson","","47","2008"
"Efficient patent pools","J Lerner, J Tirole","National Bureau of Economic Research, 2002","47","2002"
"L'économie de la recherche-développement: introduction à certains travaux théoriques","R Guesnerie, J Tirole","Revue économique, 843-871, 1985","47","1985"
"Public policy toward patent pools","J Lerner, J Tirole","Innovation Policy and the Economy 8, 157-186, 2007","46","2007"
"Comentario a la propuesta de Engel, Fischer y Galetovic sobre licitación de carreteras","J Tirole","Estudios Públicos 65, 201-214, 1997","46","1997"
"Cost padding, auditing and collusion","JJ Laffont, J Tirole","Annales d'Économie et de Statistique, 205-226, 1992","46","1992"
"Predation without reputation","D Fudenberg, J Tirole","Cambridge, Mass.: Department of Economics, Massachusetts Institute of Technology, 1985","45","1985"
"Transmission investment: alternative institutional frameworks","P Joskow, J Tirole","mimeo, 2002","44","2002"
"Environmental policy, compliance and innovation","JJ Laffont, J Tirole","European Economic Review 38 (3-4), 555-562, 1994","44","1994"
"Correlated equilibria and sunspots","E Maskin, J Tirole","Journal of Economic Theory 43 (2), 364-373, 1987","44","1987"
"Must-take cards and the tourist test","JC Rochet, J Tirole","IDEI, University of Toulouse, mimeo, 2006","43","2006"
"Handbook of industrial organization","MK Perry, R Schmalensee, RD Willig","Elsevier, edition 1, 185-255, 1989","43","1989"
"Protection de la propriété intellectuelle: une introduction et quelques pistes de réflexion","J Tirole","Tirole, J.; Henry, C.; Trommetter, M, 5-48, 2003","40","2003"
"Concurrence imparfaite","J Tirole","Economica, 1985","39","1985"
"Liquid bundles","E Farhi, J Tirole","Journal of Economic Theory 158, 634-655, 2015","38","2015"
"Market power and regulation","J Tirole","Scientific Background on the Sveriges Riksbank Prize in Economic Sciences in …, 2014","38","2014"
"The euro crisis: some reflexions on institutional reform","J Tirole","Financial Stability Review (Banque de France) 16, 225-242, 2012","37","2012"
"Régulation des relations entre fournisseurs et distributeurs","P Rey, J Tirole","La Documentation française, 2000","37","2000"
"Strengthening the efficiency of public procurement","S Saussier, J Tirole","Notes du conseil d’analyse économique, 1-12, 2015","36","2015"
"The activities of a monopoly firm in adjacent competitive markets: Economic consequences and implications for competition policy","P Rey, P Seabright, J Tirole","IDEI Working Paper 132, 2001","36","2001"
"Some political economy of global warming","J Tirole","Economics of Energy & Environmental Policy 1 (1), 121-132, 2012","35","2012"
"A model of forum shopping, with special reference to standard setting organizations","J Lerner, J Tirole","National Bureau of Economic Research, 2004","35","2004"
"Civil banishment of gang members: Circumventing criminal due process requirements","S Smith","U. Chi. L. Rev. 67, 1461, 2000","35","2000"
"Cooperation vs. collusion: How essentiality shapes co-opetition","P Rey, J Tirole","TSE Working Paper 13, 2013","34","2013"
"On nonexclusive membership in competing joint ventures","JA Hausman, GK Leonard, J Tirole","Rand Journal of economics, 43-62, 2003","34","2003"
"Financial Crises","J Tirole","Liquidity and the International Monetary, 2002","34","2002"
"Transmission rights and market power on electric power networks. I, financial rights","PL Joskow, J Tirole","MIT Center for Energy and Environmental Policy Research, 1999","34","1999"
"Lessons from the Crisis","J Tirole","Balancing the banks: Global lessons from the financial crisis, 10-77, 2010","32","2010"
"The optimal design of labor market institutions. a first pass","O Blanchard, J Tirole","NBER working paper 10443, 2004","32","2004"
"The institutional infrastructure of competition policy","J Tirole","Toulouse, Institut D’Economie Industrielle, Prepared for World Bank-CAE …, 1999","32","1999"
"Analyse économique de la notion de prix de prédation","P Rey, J Tirole","Revue française d'économie 12 (1), 3-32, 1997","32","1997"
"Narratives, imperatives and moral reasoning","A Falk, J Tirole","Unpublished manuscript, 2016","31","2016"
"Motivation intrinsèque, incitations et normes sociales","J Tirole","Revue économique 60 (3), 577-589, 2009","31","2009"
"Divergence of objectives and the governance of joint ventures","P Rey, J Tirole","Institut d'economie industrielle, Université des Sciences sociales de Toulouse, 1999","31","1999"
"Persistence of corruption","J Tirole","","31","1992"
"Tax reform from the gradient projection viewpoint","J Tirole, R Guesnerie","Journal of Public Economics 15 (3), 275-293, 1981","31","1981"
"Shadow banking and the four pillars of traditional financial intermediation","E Farhi, J Tirole","National Bureau of Economic Research, 2017","30","2017"
"The structure and performance of patent pools: empirical evidence","J Lerner, M Strojwas, J Tirole","working paper, 2003","30","2003"
"<U+535A><U+5F08><U+8BBA>","D Fudenberg, J Tirole","<U+5317><U+4EAC>: <U+4E2D><U+56FD><U+4EBA><U+6C11><U+5927><U+5B66><U+51FA><U+7248><U+793E> 101, 810-837, 2002","30","2002"
"Brookings Papers on Economic Activity: Microeconomics","BH Hall","","30","1990"
"The economics of tacit collusion: implications for merger control","M Ivaldi, B Jullien, P Rey, P Seabright, J Tirole","The Political Economy of Antitrust, 217-239, 2007","29","2007"
"tirole, J.(1997), Financial Intermediation, Loanable Funds and the Real sector","B Holmstrom","Quarterly Journal of Economics 112 (3), 663, 0","29",""
"Narratives, imperatives, and moral reasoning","R Bénabou, A Falk, J Tirole","National Bureau of Economic Research, 2018","28","2018"
"Propriété intellectuelle","C Henry, M Trommetter, L Tubiana, B Caillaud","La Documentation française, 2003","28","2003"
"Cognitive Games and Cognitive Traps","J Tirole","Toulouse School of Economics, document de travail 21, 2014","27","2014"
"Competition policy in two-sided markets","JC Rochet, J Tirole","Handbook of Antitrust Economics, 543-582, 2008","27","2008"
"Domestic and international supply of liquidity","B Holmstrom, J Tirole","American Economic Review 92 (2), 42-45, 2002","27","2002"
"The theory of industrial organization: Jean Tirole","J Tirole","The theory of industrial organization, 207, 1988","27","1988"
"<U+653F><U+5E9C><U+91C7><U+8D2D><U+4E0E><U+89C4><U+5236><U+4E2D><U+7684><U+6FC0><U+52B1><U+7406><U+8BBA>","<U+62C9><U+4E30>","<U+4E0A><U+6D77><U+4EBA><U+6C11><U+51FA><U+7248><U+793E>, 2004","25","2004"
"Loyalty and investment in cooperatives","P Rey, J Tirole","IDEI Working Papers, 2000","25","2000"
"JEUX DYNAMIQUES UN GUIDE DE L'UTILISATEUR","J Tirole","Revue d'économie politique, 551-575, 1983","25","1983"
"Payment card regulation and the use of economic analysis in antitrust","J Tirole","Competition Policy International 7 (1), 137-158, 2011","24","2011"
"Leçons d’une crise","J Tirole","Note Toulouse School of Economics, 2008","24","2008"
"Pricing under the threat of entry by a sole supplier of a network good","D Fudenberg, J Tirole","Harvard Institute of Economic Research, 1999","24","1999"
"Efficient patent pools","L Josh","NBER Working Paper, 2002","23","2002"
"Concessions, concurrence et incitations","J Tirole","Revue d'économie financière 51 (1), 79-92, 1999","22","1999"
"Prudential Regulation of Banks (Walras-Pareto Lectures; 1)","M Dewatripont, J Tirole","MIT Press, 1994","22","1994"
"Should governments commit?","JJ Laffont, J Tirole","European Economic Review 36 (2-3), 345-353, 1992","22","1992"
"From bottom of the barrel to cream of the crop: Sequential screening with positive selection","J Tirole","Econometrica 84 (4), 1291-1343, 2016","21","2016"
"A better route to tech standards","J Lerner, J Tirole","Science 343 (6174), 972-973, 2014","21","2014"
"Ownership and incentives in a transition economy","J Tirole","Privatization: Critical Perspectives on the World Economy 4, 36, 1996","21","1996"
"Country solidarity, private sector involvement and the contagion of sovereign crises","J Tirole","mimeo, 2012","20","2012"
"Information, tranching and liquidity","E Farhi, J Tirole","Unpublished working paper. Harvard University, 2012","20","2012"
"The optimal design of unemployment insurance and employment protection: A first pass","OJ Blanchard, J Tirole","Journal of the European Economic Association 6 (1), 45-77, 2007","20","2007"
"Transmission rights and market power on electric power networks. I, physical rights","PL Joskow, J Tirole","MIT Center for Energy and Environmental Policy Research, 1999","20","1999"
"Renforcer l’efficacité de la commande publique","S Saussier, J Tirole","Notes du conseil danalyse economique, 1-12, 2015","19","2015"
"Refonder l'assurance-maladie","B Dormont, PY Geoffard, J Tirole","Notes du conseil danalyse economique, 1-12, 2014","19","2014"
"Competing payment systems: Key insights from the academic literature","JC Rochet","Reserve Bank of Australia, Proceedings of Payments System Review Conference …, 2007","19","2007"
"Tying in two-sided markets and the impact of the honor all cards rule","JC Rochet, J Tirole","Unpublished manuscript, 701-711, 2003","19","2003"
"Biased principals as a discipline device","M Dewatripont, J Tirole","Japan and the World Economy 8 (2), 195-206, 1996","19","1996"
"A theory of collective reputations","J Tirole","Research Papers in Economics University of Stockholm 9, 1993","19","1993"
"Western prudential regulation: assessment, and reflections on its application to Central and Eastern Europe 1","J Tirole","Economics of Transition 2 (2), 129-150, 1994","18","1994"
"Garne theory","D Fudenberg, J Tirole","Cambridgc: MIT Prcss, 1991","18","1991"
"From Pigou to extended liability: on the optimal taxation of externalities under imperfect financial markets","J Tirole","The Review of Economic Studies 77 (2), 697-729, 2010","17","2010"
"The simple economics of open source","J Tirole, J Lerner","HBS Finance Working Paper No. 00-059, 2000","17","2000"
"Cooperation among competitors: The economics of credit card associations","JC Rochet, J Tirole","CEPR Discussion Papers, 1999","17","1999"
"Dynamic models of oligopoly","Stanford University. Institute for Mathematical Studies in the Social Sciences","","16","1983"
"Certifying new technologies","E Farhi, J Lerner, J Tirole","Journal of the European Economic Association 3 (2-3), 734-744, 2005","15","2005"
"14. Telecommunications and competition","J Tirole","The Economics of Antitrust and Regulation in Telecommunications …, 2004","15","2004"
"Cartelization by regulation","JJ Laffont, J Tirole, G Idei","Journal of Regulatory Economics 5 (2), 111-130, 1993","15","1993"
"Perfect Bayesian and sequential equilibria: A clarifying note","D Fudenberg, J Tirole","Cambridge, Mass.: Massachusetts Institute of Technology, 1988","15","1988"
"Theories of speculation","J Tirole","Cambridge, Mass.: Massachusetts Institute of Technology, Dept. of Economics, 1985","15","1985"
"A theory of exit in oligopoly","Stanford University. Institute for Mathematical Studies in the Social Sciences","","15","1983"
"Marking to market versus taking to market","G Plantin, J Tirole","American Economic Review 108 (8), 2246-76, 2018","14","2018"
"La gouvernance des institutions internationales","J Tirole","contribution G, dans JACQUET et al., op. cit, 2002","14","2002"
"The simple economics of open source","J Lemer, J Tirole","NBER Working Paper 7600, 23-76, 2000","14","2000"
"A.(1993)","JJ Laffont, J Tirole","Theory of Incentives in Procurement and Regulation, 0","14",""
"Shrouded transaction costs","H Bourguignon, RD Gomes, J Tirole","CEPR Discussion Paper No. DP10171, 2014","13","2014"
"Materialistic genius and market power: Uncovering the best innovations","EG Weyl, J Tirole","Institut d’conomie Industrielle (IDEI) working paper 629, 2010","13","2010"
"Some economics of global warming","J Tirole","Rivista di Politica Economica 98 (6), 9-42, 2008","13","2008"
"Competing liquidities: corporate securities, real bonds and bubbles","E Farhi, J Tirole","National Bureau of Economic Research, 2008","13","2008"
"Alignment of interests and the governance of joint ventures","P Rey, J Tirole","Unpublished Working Paper, University of Toulouse, 2001","13","2001"
"Global price caps and the regulation of access","JJ Laffont, J Tirole","Brazilian Review of Econometrics 20 (1), 115-146, 2000","13","2000"
"The economics of career concerns: part 1: comparing information structures","M Dewatripont, I Jewitt, J Tirole","ULB Institutional Repository, 1999","13","1999"
"Vertical Mergers and Market Foreclosure","O Hart, J Tirole","Brookings Papers on Economic Activity (Special Issue), 205-276, 1990","13","1990"
"Contraintes verticales: l'approche principal-agent","P Rey, J Tirole","Annales d'Economie et de Statistique, 175-201, 1986","13","1986"
"Une théorie normative des contrats Etat-entreprises","JJ Laffont, J Tirole","Annales d'Economie et de Statistique, 107-132, 1986","13","1986"
"A theory of incentives in procurement and regulation. 1993","JJ Laffont, J Tirole","MIT Press, Cambridge, MA, 0","13",""
"Rationalité, psychologie et économie","J Tirole","Revue française d'économie 28 (2), 9-33, 2013","12","2013"
"Laws and norms (No. w17579)","R Benabou, J Tirole","National Bureau of Economic Research, 2011","12","2011"
"Financing and access in cooperatives","P Rey, J Tirole","IDEI, Working Paper, 2001","12","2001"
"Theory of Collective Reputations with Applications to the Persistence of Corruption and to Firm Quality. Paris: Institut d’Economie Industrielle, Toulouse","JA Tirole","MIT and Ceras, 1993","12","1993"
"A theory of dynamic oligopoly.","E Maskin, J Tirole","Cambridge, Mass.: Department of Economics, Massachusetts Institute of Technology, 1985","12","1985"
"On the efficiency of fixed price equilibrium","ES Maskin, J Tirole","Journal of Economic Theory 32 (2), 317-327, 1984","12","1984"
"Creating competition through interconnection: theory and practice","J Laffont, J Tirole","INTERNATIONAL LIBRARY OF CRITICAL WRITINGS IN ECONOMICS 219, 451, 2008","11","2008"
"Profili di riforma dei regimi di protezione del lavoro","O Blanchard, J Tirole","Rivista Italiana di Diritto del Lavoro, parte I, fasc 2, 161-211, 2004","11","2004"
"Unforseen contingencies, property rights, and incomplete contracts","E Maskin, J Tirole","Harvard Institute of Economic Research Working Papers, 1997","11","1997"
"A note on environmental innovation","JJ Laffont, J Tirole","Cambridge, Mass.: Dept. of Economics, Massachusetts Institute of Technology, 1994","11","1994"
"Managerial switching and myopia","JJ Laffont, J Tirole","MIT Energy Lab, 1987","11","1987"
"Pandering and pork-barrel politics","E Maskin, J Tirole","Journal of Public Economics 176, 79-93, 2019","10","2019"
"La protection du consommateur: rationalité limitée et régulation","X Gabaix, P Mongin, A Landier, D Thesmar, J Tirole","La Documentation française, 2012","10","2012"
"Intellectual property and health in developing countries","J Tirole","Understanding poverty 303, 313, 2006","10","2006"
"Unforeseen contingencies and incomplete contracts","J Tirole, E Maskin","Review of Economic Studies 66 (1), 83-114, 1999","10","1999"
"DE LA RÉGLEMENTATION","J Tirole","L'Actualité économique 66 (3), 305-318, 1990","10","1990"
"A theory of dynamic oligopoly, II: Price competition","E Maskin, J Tirole","Massachusetts Institute of Technology (MIT), Department of Economics Working …, 1985","10","1985"
"Completing the euro","P Artus, A Bénassy-Quéré, L Boone, J Cailloux, J Delpla, E Farhi, ...","Notes du conseil d’analyse économique, 1-12, 2013","9","2013"
"Balancing the Banks: Global lessons from the financial crisis","J Tirole, K Tribe, M Dewatripont, JC Rochet","Princeton University Press, 2010","9","2010"
"<U+516C><U+53F8><U+91D1><U+878D><U+7406><U+8BBA>: <U+4E0B>","<U+68AF><U+82E5><U+5C14>","<U+4E2D><U+56FD><U+4EBA><U+6C11><U+5927><U+5B66><U+51FA><U+7248><U+793E>, 2007","9","2007"
"Concessions de services publics: quel contrat l'Etat doit-il passer pour garantir un service optimal?","J Tirole","Problèmes économiques (Paris), 10-15, 1999","9","1999"
"Incentives for cost reduction in defense procurement","MH Riordan, J Leitzel, J Tirole","Incentives in Procurement Contracting (Westview Press, Boulder, CO), 135-146, 1993","9","1993"
"Competition-reducing vertical restraints","J Tirole","Industrial Structure in the New Industrial Economics, Oxford University …, 1990","9","1990"
"Principals with private information, I: Independent values","E Maskin, J Tirole","Harvard Institute of Economic Resarch, Harvard University, 1986","9","1986"
"Asset Bubbles and Overlapping Generators: A Synthesis","Stanford University. Institute for Mathematical Studies in the Social Sciences","","9","1984"
"Taux d'actualisation et optimum second","J Tirole","Revue économique, 829-869, 1981","9","1981"
"Price caps as welfare-enhancing coopetition","P Rey, J Tirole","Journal of Political Economy, 2019","8","2019"
"Policy brief—translating the collective climate goal into a common climate commitment","P Cramton, A Ockenfels, J Tirole","Review of Environmental Economics and Policy 11 (1), 165-171, 2017","8","2017"
"Switching bubbles: From outside to inside bubbles","S Basco","European Economic Review 87, 236-255, 2016","8","2016"
"Renforcer le capital-risque français","M Ekeland, A Landier, J Tirole","Notes du conseil danalyse economique, 1-12, 2016","8","2016"
"L'apprentissage au service de l'emploi","P Cahuc, M Ferracci, J Tirole, É Wasmer","Notes du conseil danalyse economique, 1-12, 2014","8","2014"
"Déficits de liquidité: fondements théoriques","J Tirole","RSF REVUE, 57, 2008","8","2008"
"Protection de l'emploi et procédures de licenciement","France. Conseil d'analyse économique","la Documentation française, 2003","8","2003"
"Some reflections on open source software","E Peyrache, J Cremer, J Tirole","Communications & Stratégies 40, 139-160, 2002","8","2002"
"<U+94F6><U+884C><U+76D1><U+7BA1>","M Dewatripont, J Tirole","<U+4E0A><U+6D77>: <U+590D><U+65E6><U+5927><U+5B66><U+51FA><U+7248><U+793E>, 2002","8","2002"
"Competition in Telecommunications MIT Press Cambridge","JJ Laffont, J Tirole","MA, 2000","8","2000"
"The economics of career concerns: part 2: application to missions and accountability of government agencies","M Dewatripont, I Jewitt, J Tirole","ULB Institutional Repository, 1999","8","1999"
"Comments on the paper of Schwart","J Tirole","Contract economics, Cambridge, Blackwell Publishers, 109-113, 1992","8","1992"
"In Honor of David Kreps, Winner of the John Bates Clark Medal","J Tirole","Journal of Economic Perspectives 4 (3), 149-170, 1990","8","1990"
"Patent disclosures and standard-setting","J Lerner, H Tabakovic, J Tirole","National Bureau of Economic Research, 2016","7","2016"
"Wicksell lectures: Inside and outside liquidity","B Holmstrom, J Tirole","","7","2010"
"A cognitive theory of identity, dignity, and taboos","R Bénabou, J Tirole","Unpublished, 2006","7","2006"
"Competition in Telecommunications (The Munich Lectures)","JJ Laffont, J Tirole","Cambridge, Massachusetts: MIT Press, 2000","7","2000"
"Advocates","J Tirole, M Dewatripont","Journal of Political Economy 107 (1), 1999","7","1999"
"Collusion et théorie des organisations","J Tirole","Revue d'économie industrielle, 247-286, 1995","7","1995"
"Modelli dinamici di oligopolio","D Fudenberg, J Tirole, G Martini","Giuffré, 1994","7","1994"
"Noncooperative Game Theory: A User’s Manual","J Tirole","The Theory of Industrial Organization, MIT Press, Cambridge, 1988","7","1988"
"What role for economists in policy-making?","A Bénassy-Quéré, OJ Blanchard, J Tirole","Notes du conseil d’analyse économique, 1-12, 2017","6","2017"
"Symposium on international climate negotiations","P Cramton, A Ockenfels, S Stoft","Economics of Energy & Environmental Policy 4 (2), 1-4, 2015","6","2015"
"Cognition-intensive contracting","J Tirole","Discussion Paper, Toulouse School of Economics, 2015","6","2015"
"Les enjeux économiques du droit des faillites","G Plantin, D Thesmar, J Tirole","Notes du conseil danalyse economique, 1-12, 2013","6","2013"
"Compléter l'euro","P Artus, A Bénassy-Quéré, L Boone, J Cailloux, J Delpla, E Farhi, ...","Notes du conseil danalyse economique, 1-12, 2013","6","2013"
"The economics of tacit collusion in merger analysis","M Ivaldi, B Jullien, P Rey, P Seabright, J Tirole","Political Economy of Antitrust, 217-239, 2007","6","2007"
"A primer on Foreclosure","J Tirole, P Rey","Handbook of Industrial Organization 3, 2007","6","2007"
"A cognitive theory of identity","R Benabou, J Tirole","Dignity and Taboos, 2006","6","2006"
"Platform competition in two-sided markets","J Tirole, JC Rochet","Journal of the European Economic Association 1 (4), 990-1029, 2003","6","2003"
"The economics of horizontal mergers: unilateral and coordinated effects","M Ivaldi, B Jullien, P Rey, P Seabright, J Tirole","Report for DG Competition, European Commission, March/November, IDEI, Toulouse, 2003","6","2003"
"Reaching higher productivity growth in France and Germany","O Blanchard, CM Baily, H Gersbach, M Schnitzer, J Tirole","Sector case: Retail Trade, McKinsey Global Institute, 2002","6","2002"
"Concerns, Part I: Comparing","M DEWATRIPONT, IAN JEWITT, J TIROLE","Review of Economic Studies 66, 183-198, 1999","6","1999"
"Network Competition","JJ Laffont, P Rey, J Tirole","Institut d'Economie Industrielle, 1997","6","1997"
"Shrouded transaction costs: must-take cards, discounts and surcharges","H Bourguignon, R Gomes, J Tirole","International Journal of Industrial Organization 63, 99-144, 2019","5","2019"
"Missed Sales and the Pricing of Ancillary Goods","R Gomes, J Tirole","The Quarterly Journal of Economics 133 (4), 2097-2169, 2018","5","2018"
"10 Effective Institutions against Climate Change","C Gollier, J Tirole","Global Carbon Pricing, 165, 2017","5","2017"
"There are many reasons to be cautious about bitcoin","J Tirole","Financial Times 30, 2017, 2017","5","2017"
"Corporate Governance","C Governance","Central University, 2016","5","2016"
"Théorie des incitations et réglementation","JJ Laffont, J Tirole","","5","2013"
"Pegs, risk management, and financial crises","PA Pathak, J Tirole","Risk Management, and Financial Crises (July 28, 2004), 2004","5","2004"
"Alcohol Prohibition, Alcohol Consumption, and Cirrhosis","A Dills, JA Miron, PR Gilchrist, R Rosenthal, M Thornton, J Tirole, ...","typescript, Boston University, 2001","5","2001"
"Personal Rules","R Bénabou, J Tirole","mimeo, Princeton, 2000","5","2000"
"El gobierno corporativo","J Tirole","Economía 22 (44), 9-60, 1999","5","1999"
"Accès, prix et concurrence","JJ Laffont, J Tirole","Politique Economique Fondements Théoriques, 1997","5","1997"
"Comment on the Proposal of Engel, Fischer and Galetovic on Highway Franchising","J Tirole","Estudios Públicos 65, 201-214, 1997","5","1997"
"Libéralisation et charges daccès","JJ Laffont, J Tirole","Annales des télécommunications 50 (2), 306-314, 1995","5","1995"
"Dynamic programming","E Maskin, J Tirole","Unforseen Contingencies, and Incomplete, 1995","5","1995"
"The Incentive Theory of Procure—ment and Regulation","JJ Laffont, J Tirole","MIT Press, 1993","5","1993"
"Game Theory, Cambridge, Massa-chusetts","D Fudenberg, J Tirole","T he MIT Press, 1991","5","1991"
"Price discrimination","J Tirole","The Theory of Industrial Organization. MIT Press, Cambridge, MA, 15-45, 1988","5","1988"
"Repeated auctions of incentive contracts, investment and bidding parity with an application to takeovers","JJ Laffont, J Tirole","Cambridge, Mass.: Dept. of Economics, Massachusetts Institute of Technology, 1987","5","1987"
"Economia del bene comune","J Tirole","Edizioni Mondadori, 2017","4","2017"
"Les économistes dans la cité","A Benassy-Quéré, OJ Blanchard, J Tirole","Notes du conseil danalyse economique, 1-12, 2017","4","2017"
"Why Paris did not solve the climate dilemma","R Cooper, P Cramton, S Dion, O Edenhofer, C Gollier, É Laurent, ...","Global Carbon Pricing-The Path to Climate Cooperation, 2016","4","2016"
"Pour un accord efficace sur le climat","C Gollier, J Tirole","Le Monde (4 Jun. 2016), 2015","4","2015"
